,handle,text,cleantext
2810,1,The full faith and credit of the United States is not something we can just gamble away Hillary on Trumps reckless economic plan,full faith credit United States something gamble away Hillary Trumps reckless economic plan
2811,1,He says women will start making equal pay as soon as they do as good a job as menas if we arent already Hillary on realDonaldTrump,says women start making equal pay soon good job menas arent already Hillary realDonaldTrump
2812,1,Donald Trump actually stood on a debate stage in November and said that wages are too high in this country Hillary,Donald Trump actually stood debate stage November said wages high country Hillary
2813,1,Donald Trump is proud of his recklessnessthats his business But when hes running for president its ours,Donald Trump proud recklessnessthats business hes running president
2814,1,TheEconomist declared Donald Trump one of the 10 biggest threats to the global economy,TheEconomist declared Donald Trump one 10 biggest threats global economy
2815,1,elizabethforma and MittRomney agree Trump would put us into a deep recession,elizabethforma MittRomney agree Trump would put us deep recession
2816,1,Ill admitits a little wonky butI sweat the specifics because they matter,Ill admitits little wonky butI sweat specifics matter
2817,1,If youre running for president you should say what you want to do how youre going to pay for it and how youll get it done Hillary,youre running president say want youre going pay youll get done Hillary
2818,1,Our president should fight for familiesnot just themselves Hillary speaks on the economy live from Ohio,president fight familiesnot Hillary speaks economy live Ohio
2819,1,Donald Trumps tax plan would add 30 trillion to the national debt over 20 years Thats trillionwith a t,Donald Trumps tax plan would add 30 trillion national debt 20 years Thats trillionwith
2820,1,What is Trump spending his meager campaign resources on Why himself of course,Trump spending meager campaign resources course
2821,0,I will be making a big speech tomorrow to discuss the failed policies and bad judgment of Crooked Hillary Clinton,making big speech tomorrow discuss failed policies bad judgment Crooked Hillary Clinton
2822,1,Trumps economic proposals could produce a prolonged recessionand reduce employment by 35 million jobs WSJ,Trumps economic proposals could produce prolonged recessionand reduce employment 35 million jobs WSJ
2823,1,Trumps gotten rich driving companies into the ground What will he do to the US economy Oh waitwe know,Trumps gotten rich driving companies ground US economy Oh waitwe know
2824,0,Crooked Hillary Clinton is totally unfit to be our presidentreally bad judgement and a temperament according to new book which is a mess!,Crooked Hillary Clinton totally unfit presidentreally bad judgement temperament according new book mess!
2825,1,JoeBiden is rightDonald Trumps worldview doesnt reflect our values and its not who we are,JoeBiden rightDonald Trumps worldview doesnt reflect values
2826,1,Its time to demand more than thoughts and prayers from our elected officials DisarmHate,time demand thoughts prayers elected officials DisarmHate
2827,1,Enough H,Enough H
2828,1,An overwhelming majority of Americans and gun owners support steps to reduce gun violence RT if youre one of them DisarmHate,overwhelming majority Americans gun owners support steps reduce gun violence RT youre one DisarmHate
2829,1,America has always been a nation of immigrants and refugees On WorldRefugeeDay lets reaffirm our commitment to welcoming them H,America always nation immigrants refugees WorldRefugeeDay lets reaffirm commitment welcoming H
2830,1,Our prayers are not enough to prevent gun violence Tell your senators to vote to expand background checks tonight,prayers enough prevent gun violence Tell senators vote expand background checks tonight
2831,1,You inspire me too ChrisMurphyCT Lets all demand action on gun violence prevention,inspire ChrisMurphyCT Lets demand action gun violence prevention
2832,1,Tonight the Senate will vote on commonsense measures to prevent gun violence Tell your senators you support them,Tonight Senate vote commonsense measures prevent gun violence Tell senators support
2833,1,This is just common sense Its time for Congress to act,common sense time Congress act
2834,1,We owe families of gun violence victims more than prayers Tell your senators to act on gun violence prevention,owe families gun violence victims prayers Tell senators act gun violence prevention
2835,1,A behindthescenes look at a historic night,behindthescenes look historic night
2836,1,Happy first day of summer,Happy first day summer
2837,0,When I said that if within the Orlando club you had some people with guns I was obviously talking about additional guards or employees,said within Orlando club people guns obviously talking additional guards employees
2838,1,Gay rights are human rights and human rights are gay rights Being LGBT does not make you less human,Gay rights human rights human rights gay rights LGBT make less human
2839,0,DJohnsonPGA We are so proud of you Dustin Your reaction under pressure was amazing First of many Majors You are a true CHAMPION!,DJohnsonPGA proud Dustin reaction pressure amazing First many Majors true CHAMPION!
2840,1,Youll want to read the story behind this photo,Youll want read story behind photo
2841,1,Shirley was 5 years old when women won the right to vote Today shes rooting for the first woman president,Shirley 5 years old women right vote Today shes rooting first woman president
2842,1,What a joy being with our new grandson Aidan So grateful H,joy new grandson Aidan grateful H
2843,1,Imagine if this was our president,Imagine president
2844,1,They may be too young to vote but these supporters are making their voices heard,may young vote supporters making voices heard
2845,1,Happy Fathers Day BillClinton!,Happy Fathers Day BillClinton!
2846,0,bfraser747 Watch out HillaryClinton Support realDonaldTrump MakeAmericaGreatAgain,bfraser747 Watch HillaryClinton Support realDonaldTrump MakeAmericaGreatAgain
2847,0,Yesterdays failing NYTimes fraudulently shows an empty room prior to my speech when in fact it was packed!,Yesterdays failing NYTimes fraudulently shows empty room prior speech fact packed!
2848,0,How can the NY Times show an empty room hours before my speech even started when they knew it was going to be packed So totally dishonest!,NY Times show empty room hours speech even started knew going packed totally dishonest!
2849,0,Donald Trumps Speech Is a Game Changer Trump2016,Donald Trumps Speech Game Changer Trump2016
2850,0,See you soon Arizona! Trump2016,See soon Arizona! Trump2016
2851,0,I love you Arizona! Thank you! Trump2016 AmericaFirst,love Arizona! Thank you! Trump2016 AmericaFirst
2852,1,Donald Trump launched his campaign one year ago this week And what a year its been,Donald Trump launched campaign one year ago week year
2853,0,MAKE AMERICA GREAT AGAIN! MAKE AMERICA SAFE AGAIN! Trump2016 AmericaFirst,MAKE AMERICA GREAT AGAIN! MAKE AMERICA SAFE AGAIN! Trump2016 AmericaFirst
2854,0,Thank you Las Vegas Nevada! Trump2016 AmericaFirst,Thank Las Vegas Nevada! Trump2016 AmericaFirst
2855,0,In Las Vegas getting ready to speak!,Las Vegas getting ready speak!
2856,1,Im supporting Hillary Clinton because shes a fighter a fighter with guts SenWarren to the BostonGlobe,Im supporting Hillary Clinton shes fighter fighter guts SenWarren BostonGlobe
2857,0,Join me in Phoenix Arizona today at 4pm! Trump2016 AmericaFirst,Join Phoenix Arizona today 4pm! Trump2016 AmericaFirst
2858,1,If your business or organization is hiring and needs someone to get the job done hire a veteran,business organization hiring needs someone get job done hire veteran
2859,1,On June 18 1983 Sally Ride became the first American woman and first LGBT astronaut to go to space,June 18 1983 Sally Ride became first American woman first LGBT astronaut go space
2860,0,Thank you Houston Texas! AmericaFirst Trump2016,Thank Houston Texas! AmericaFirst Trump2016
2861,1,Gun violence and hate arent isolatedhomophobia in Orlando racism in Charleston We need to fight them together,Gun violence hate arent isolatedhomophobia Orlando racism Charleston need fight together
2862,0,Thank you! AmericaFirst,Thank you! AmericaFirst
2863,0,The convention in Cleveland will be amazing!,convention Cleveland amazing!
2864,0,Thank you on my way!,Thank way!
2865,0,Thank you DallasPD!,Thank DallasPD!
2866,0,Join me in Phoenix Arizona tomorrow at 4pm! Trump2016 AmericaFirst,Join Phoenix Arizona tomorrow 4pm! Trump2016 AmericaFirst
2867,1,In the spirit of the Charleston9 lets bridge our divides fight for change and remember that love never fails,spirit Charleston9 lets bridge divides fight change remember love never fails
2868,1,We cant stop fighting until every LGBT American can live life freely openly and without fear,cant stop fighting every LGBT American live life freely openly without fear
2869,1,One year ago we lost 9 lives in Charleston 49 in Orlando on Sunday 26 in Newtown Too many others This has to stop We need to change H,One year ago lost 9 lives Charleston 49 Orlando Sunday 26 Newtown many others stop need change H
2870,1,You dont have to be LGBT to stand with the LGBT community We all have a stake in equality Thank you Michael,dont LGBT stand LGBT community stake equality Thank Michael
2871,0,THANK YOU! AmericaFirst,THANK YOU! AmericaFirst
2872,1,Donald Trump says hes the real friend of the LGBT community Yeah no,Donald Trump says hes real friend LGBT community Yeah
2873,1,Trump has made a big show of supposedly supporting veterans In reality hes done the exact opposite,Trump made big show supposedly supporting veterans reality hes done exact opposite
2874,1,Helpful,Helpful
2875,0,MAKE AMERICA GREAT AGAIN! MAKE AMERICA SAFE AGAIN!,MAKE AMERICA GREAT AGAIN! MAKE AMERICA SAFE AGAIN!
2876,0,People very unhappy with Crooked Hillary and Obama on JOBS and SAFETY! Biggest trade deficit in many years! More attacks will follow Orlando,People unhappy Crooked Hillary Obama JOBS SAFETY! Biggest trade deficit many years! attacks follow Orlando
2877,0,Amazing crowd last night in Dallas more spirit and passion than ever before Today all over the great State of Texas!,Amazing crowd last night Dallas spirit passion ever Today great State Texas!
2878,0,VoteTrumpMAGA The media attack on realDonaldTrump is relentless They are desperate But they keep Trump in the news a good thing,VoteTrumpMAGA media attack realDonaldTrump relentless desperate keep Trump news good thing
2879,1,Hard to believe its only been a year since Trump announced his candidacy for president,Hard believe year since Trump announced candidacy president
2880,0,Thank you Dallas Texas!,Thank Dallas Texas!
2881,1,Hi,Hi
2882,1,It is cruel and terrible that her life was cut short by a violent act of political intolerance Hillary on Jo Cox,cruel terrible life cut short violent act political intolerance Hillary Jo Cox
2883,1,Thank you SpencerJCox Despite our differences if we stand together hate can never defeat us,Thank SpencerJCox Despite differences stand together hate never defeat us
2884,1,oprah Thank you Its an honor to have the support of someone whos shattered so many glass ceilings,oprah Thank honor support someone whos shattered many glass ceilings
2885,1,Thanks Chris for showing what leadership looks like I hope GOP senators take note Looking forward to the vote H,Thanks Chris showing leadership looks like hope GOP senators take note Looking forward vote H
2886,0,Houston TX Las Vegas NV Phoenix AZ,Houston TX Las Vegas NV Phoenix AZ
2887,1,Hillary helped get health care for 8 million kids One of the first ads of the general election,Hillary helped get health care 8 million kids One first ads general election
2888,0,Join me in Houston Texas tomorrow night at 7pm! Tickets,Join Houston Texas tomorrow night 7pm! Tickets
2889,1,Hillary Clinton has proven herself as a champion of the labor movement,Hillary Clinton proven champion labor movement
2890,0,Donald Trumps Speech Is a Game Changer,Donald Trumps Speech Game Changer
2891,0,The trade deficit rose to a 7yr high thanks to horrible trade policies Clinton supports I will fix it fast JOBS!,trade deficit rose 7yr high thanks horrible trade policies Clinton supports fix fast JOBS!
2892,0,McAllen Texas 8 miles from US Mexico border Trump2016 Video,McAllen Texas 8 miles US Mexico border Trump2016 Video
2893,1,One year ago today realDonaldTrump announced his campaign for president And what a year its been,One year ago today realDonaldTrump announced campaign president year
2894,1,Its absurd that people with suspected terrorist links can buy a gun in America no questions asked,absurd people suspected terrorist links buy gun America questions asked
2895,1,Belgium Donald Trumps favorite city,Belgium Donald Trumps favorite city
2896,0,realericjallen realDonaldTrump is a Common Sense Conservative! President TrumpCompetence Safety Unity amp US JOBS JOBS JOB,realericjallen realDonaldTrump Common Sense Conservative! President TrumpCompetence Safety Unity amp US JOBS JOBS JOB
2897,1,Thank you SenWarren Proud to be in this fight with you,Thank SenWarren Proud fight
2898,0,I will be interviewed on greta at 700 PM FoxNews,interviewed greta 700 PM FoxNews
2899,1,An assault on our values A new low Plays into ISISs hands Newspapers react to Trumps Orlando speech,assault values new low Plays ISISs hands Newspapers react Trumps Orlando speech
2900,0,Finally an accurate story from the Washington Post!,Finally accurate story Washington Post!
2901,0,Join me in Dallas Texas on Thursday! AmericaFirst Trump2016,Join Dallas Texas Thursday! AmericaFirst Trump2016
2902,0,Thank you Atlanta Georgia! Will be back soon! AmericaFirst,Thank Atlanta Georgia! back soon! AmericaFirst
2903,1,Thousands of families are together thanks to POTUSs action on DACA 4 years ago We need to protect DACADAPA and pass immigration reform,Thousands families together thanks POTUSs action DACA 4 years ago need protect DACADAPA pass immigration reform
2904,1,Some fights are too important to stay silent Preventing gun violence is one of them Stand strong ChrisMurphyCT,fights important stay silent Preventing gun violence one Stand strong ChrisMurphyCT
2905,1,Your GOP presidential nominee responding to a terrorist attack with lies and conspiracy theories,GOP presidential nominee responding terrorist attack lies conspiracy theories
2906,1,Donald Trump is an expert at distracting people from the fact that he has nothing substantive to say for himself,Donald Trump expert distracting people fact nothing substantive say
2907,0,I will be meeting with the NRA who has endorsed me about not allowing people on the terrorist watch list or the no fly list to buy guns,meeting NRA endorsed allowing people terrorist watch list fly list buy guns
2908,0,The press is so totally biased that we have no choice but to take our tough but fair and smart message directly to the people!,press totally biased choice take tough fair smart message directly people!
2909,0,An Media fell all over themselves criticizing what DonaldTrump may have insinuated about POTUS But hes right,Media fell criticizing DonaldTrump may insinuated POTUS hes right
2910,1,America has always been a country of we not me And weve always been stronger together,America always country weve always stronger together
2911,0,Thank you Greensboro North Carolina! Will be back soon! AmericaFirst,Thank Greensboro North Carolina! back soon! AmericaFirst
2912,1,Donald Trump just gave us his plan for defeating terrorismconspiracy theories and selfcongratulations,Donald Trump gave us plan defeating terrorismconspiracy theories selfcongratulations
2913,1,A lot of people are saying Donald Trump is a conspiracy theorist,lot people saying Donald Trump conspiracy theorist
2914,1,We just won Washington DC! Grateful to everyone who voted,Washington DC! Grateful everyone voted
2915,1,When BillClinton took office GeorgeHWBush left him a note that represents the best of our values,BillClinton took office GeorgeHWBush left note represents best values
2916,1,For 241 years brave USArmy soldiers have answered the call to serve and protect our nation Thank you ArmyBDay,241 years brave USArmy soldiers answered call serve protect nation Thank ArmyBDay
2917,1,realdonaldtrump Attacking Muslim Americans is wrong and it makes it harder for us to defeat terrorism,realdonaldtrump Attacking Muslim Americans wrong makes harder us defeat terrorism
2918,1,An attack on LGBT Americans is an attack on all Americans,attack LGBT Americans attack Americans
2919,0,TONIGHT! NORTH CAROLINA WEDNESDAY! GEORGIA SATURDAY! NEVADA,TONIGHT! NORTH CAROLINA WEDNESDAY! GEORGIA SATURDAY! NEVADA
2920,1,RT if youre voting for Hillary today Washington DC Find your polling location here,RT youre voting Hillary today Washington DC Find polling location
2921,0,HAPPY 241st BIRTHDAY to the USArmy! THANK YOU!,HAPPY 241st BIRTHDAY USArmy! THANK YOU!
2922,1,Todays NetNeutrality decision is a big win for consumers innovation and freedom of expression on the internet,Todays NetNeutrality decision big win consumers innovation freedom expression internet
2923,0,Thank you to the LGBT community! I will fight for you while Hillary brings in more people that will threaten your freedoms and beliefs,Thank LGBT community! fight Hillary brings people threaten freedoms beliefs
2924,1,This is one nation under God indivisible with liberty and justice for all Not just for those who look or love or worship one wayfor all,one nation God indivisible liberty justice look love worship one wayfor
2925,1,We need to work together to keep our country and our citizens safe None of this will be helped by anything Trump has to offer,need work together keep country citizens safe None helped anything Trump offer
2926,1,People cant board planes with full shampoo bottlesbut people being watched by the FBI for terrorism can buy a gun no questions asked,People cant board planes full shampoo bottlesbut people watched FBI terrorism buy gun questions asked
2927,1,We need a CommanderinChief who can grapple with our challenges in all their complexity with real plans that actually address them,need CommanderinChief grapple challenges complexity real plans actually address
2928,1,Trumps statements are liesbut he tells them because he has to distract from the fact that he has nothing substantive to say for himself,Trumps statements liesbut tells distract fact nothing substantive say
2929,1,He said Ill abolish the 2nd Amendment Wrong He said Ill let a flood of refugees into our country without any screening Also wrong,said Ill abolish 2nd Amendment Wrong said Ill let flood refugees country without screening Also wrong
2930,1,Trumps Muslim ban is wrong dangerous and in this instance nonsensical The terrorist in Orlando was born in Queensjust like Donald,Trumps Muslim ban wrong dangerous instance nonsensical terrorist Orlando born Queensjust like Donald
2931,1,If Donald suggests I wont call this threat what it is he hasnt been listening But I will not declare war on an entire religion,Donald suggests wont call threat hasnt listening declare war entire religion
2932,1,It matters what we do not just what we say It didnt matter what we called bin Ladenit mattered that we got bin Laden Hillary,matters say didnt matter called bin Ladenit mattered got bin Laden Hillary
2933,1,Americans dont need conspiracy theories and pathological selfcongratulations We need leadership common sense and concrete plans,Americans dont need conspiracy theories pathological selfcongratulations need leadership common sense concrete plans
2934,1,Trumps rhetoric is shameful It was one thing when he was a reality TV personality Its another when hes running for president,Trumps rhetoric shameful one thing reality TV personality another hes running president
2935,1,People of different faiths backgrounds sexual orientations and gender identities are coming together to say we wont let hate defeat us,People different faiths backgrounds sexual orientations gender identities coming together say wont let hate defeat us
2936,1,I believe that despite those differences of opinion were all on the same teamTheres more that unites us than divides us Hillary,believe despite differences opinion teamTheres unites us divides us Hillary
2937,1,I believe we Americans are capable of protecting Second Amendment rights while making sure guns dont fall into the wrong hands Hillary,believe Americans capable protecting Second Amendment rights making sure guns dont fall wrong hands Hillary
2938,1,Yesterday Trump spoke about the terrorist attack in Orlando Watch live as Hillary responds,Yesterday Trump spoke terrorist attack Orlando Watch live Hillary responds
2939,1,Gun violence prevention laws might not stop every shooting or terrorist attackbut they will save lives,Gun violence prevention laws might stop every shooting terrorist attackbut save lives
2940,0,AMERICA FIRST!,AMERICA FIRST!
2941,0,American must now get very tough very smart and very vigilant We cannot admit people into our country without extraordinary screening,American must get tough smart vigilant cannot admit people country without extraordinary screening
2942,1,If youre too dangerous to get on a plane youre too dangerous to buy a gun in America,youre dangerous get plane youre dangerous buy gun America
2943,1,I have no doubt we can meet this challengeif we meet it together Hillarys address on the Orlando attack,doubt meet challenge meet together Hillarys address Orlando attack
2944,1,A nightmare thats become mindnumbingly familiar Hillary on the deadliest shooting in US history,nightmare thats become mindnumbingly familiar Hillary deadliest shooting US history
2945,0,Join me in Atlanta on Wednesday at noon! Trump2016 Tickets,Join Atlanta Wednesday noon! Trump2016 Tickets
2946,1,Weapons of war like those used in Orlando and San Bernardino have no place on our streets,Weapons war like used Orlando San Bernardino place streets
2947,0,Crooked Hillary says we must call on Saudi Arabia and other countries to stop funding hate I am calling on contd,Crooked Hillary says must call Saudi Arabia countries stop funding hate calling contd
2948,0,Saudi Arabia and many of the countries that gave vast amounts of money to the Clinton Foundation contd,Saudi Arabia many countries gave vast amounts money Clinton Foundation contd
2949,0,I thought people werent celebrating They were cheering all over even this savage from Orlando I was right,thought people werent celebrating cheering even savage Orlando right
2950,0,In my speech on protecting America I spoke about a temporary ban which includes suspending immigration from nations tied to Islamic terror,speech protecting America spoke temporary ban includes suspending immigration nations tied Islamic terror
2951,0,Based on the incredibly inaccurate coverage and reporting of the record setting Trump campaign we are hereby,Based incredibly inaccurate coverage reporting record setting Trump campaign hereby
2952,0,I am no fan of President Obama but to show you how dishonest the phony Washington Post is,fan President Obama show dishonest phony Washington Post
2953,1,Our diversity isnt a liability in the fight against terrorism Its an asset It makes us stronger,diversity isnt liability fight terrorism asset makes us stronger
2954,0,TERRORISM IMMIGRATION AND NATIONAL SECURITY SPEECH TRANSCRIPT,TERRORISM IMMIGRATION NATIONAL SECURITY SPEECH TRANSCRIPT
2955,1,We have to stand together and be proud together There is no better rebuke to the terrorists and all those who hate,stand together proud together better rebuke terrorists hate
2956,0,Congratulations to the 2016 StanleyCup Champions Pittsburgh Penguins!,Congratulations 2016 StanleyCup Champions Pittsburgh Penguins!
2957,1,Our open diverse society is an asset in the struggle against terrorism not a liability It makes us stronger,open diverse society asset struggle terrorism liability makes us stronger
2958,1,Weve seen too many examples of the struggle to live freely openly and without fear being marked by violence We have to stand together,Weve seen many examples struggle live freely openly without fear marked violence stand together
2959,1,To all the LGBT people grieving today you have millions of allies who will always have your back I am one of them Hillary,LGBT people grieving today millions allies always back one Hillary
2960,1,The terrorist in Orlando targeted LGBT Americans out of hatred and bigotry An attack on any American is an attack on all Americans,terrorist Orlando targeted LGBT Americans hatred bigotry attack American attack Americans
2961,1,Inflammatory antiMuslim rhetoric hurts the vast majority of Muslims who love freedom and hate terror Its wrong and its dangerous,Inflammatory antiMuslim rhetoric hurts vast majority Muslims love freedom hate terror wrong dangerous
2962,1,Background checks and an assault weapons ban might not stop every attackbut theyll stop some and save lives We need to fight for them,Background checks assault weapons ban might stop every attackbut theyll stop save lives need fight
2963,1,In Orlando and San Bernardino terrorists used assault weapons like the AR15 to kill Americans We should make it harder for them to do so,Orlando San Bernardino terrorists used assault weapons like AR15 kill Americans make harder
2964,1,If the FBI is watching you for suspected terrorist links you shouldnt be able to just go buy a gun with no questions asked,FBI watching suspected terrorist links shouldnt able go buy gun questions asked
2965,1,We need to stop terrorists from getting the weapons they need to carry out attacks,need stop terrorists getting weapons need carry attacks
