,handle,text,cleantext
1515,0,Thank you Denver Colorado! MakeAmericaGreatAgain!,Thank Denver Colorado! MakeAmericaGreatAgain!
1516,0,As usual Hillary amp the Dems are trying to rig the debates so 2 are up against major NFL games Same as last time w Bernie Unacceptable!,usual Hillary amp Dems trying rig debates 2 major NFL games last time w Bernie Unacceptable!
1517,1,Hillary accepted the Democratic nomination for president on Thursday There were balloons,Hillary accepted Democratic nomination president Thursday balloons
1518,0,CrookedHillary Job Application,CrookedHillary Job Application
1519,0,Hillary Clinton should not be given national security briefings in that she is a lose cannon with extraordinarily bad judgement amp insticts,Hillary Clinton given national security briefings lose cannon extraordinarily bad judgement amp insticts
1520,0,Thank you to the amazing law enforcement officers in Colorado! MakeAmericaGreatAgain LESM,Thank amazing law enforcement officers Colorado! MakeAmericaGreatAgain LESM
1521,1,Donald Trump has painted a dark divisive picture of America We have 102 days to stop him from becoming president,Donald Trump painted dark divisive picture America 102 days stop becoming president
1522,1,Headlines for the history books,Headlines history books
1523,1,With the first local transmission of Zika in FL its even more critical for Republicans to stop blocking action,first local transmission Zika FL even critical Republicans stop blocking action
1524,0,Thank you Colorado Springs Get out amp VOTE TrumpPence16 in November!,Thank Colorado Springs Get amp VOTE TrumpPence16 November!
1525,0,Only a Reagan or a Trumplike figure in the White House will achieve this goal,Reagan Trumplike figure White House achieve goal
1526,1,Big victory for democracy as the 4th Circuit just struck down a NC voter discrimination law Lets keep fighting to make voting easier H,Big victory democracy 4th Circuit struck NC voter discrimination law Lets keep fighting make voting easier H
1527,1,Capt Khan embodied the best of our values when his actions saved his unit Last night his parents told his story,Capt Khan embodied best values actions saved unit Last night parents told story
1528,0,Even Bill is tired of the lies SAD!,Even Bill tired lies SAD!
1529,0,Join me in Colorado Springs at 2pm or in Denver tonight at 7pm! Colorado Springs Denver,Join Colorado Springs 2pm Denver tonight 7pm! Colorado Springs Denver
1530,0,What Bernie Sanders really thinks of Crooked Hillary Clinton,Bernie Sanders really thinks Crooked Hillary Clinton
1531,1,Contrary to Donald Trump I believe every time we knock down a barrier in America it liberates everyone in America Hillary,Contrary Donald Trump believe every time knock barrier America liberates everyone America Hillary
1532,0,I am watching Crooked Hillary speak Same old stuff our country needs change!,watching Crooked Hillary speak old stuff country needs change!
1533,1,Weve got to make this economy work for everyone not just those at the top Hillary,Weve got make economy work everyone top Hillary
1534,1,Our Founders came together to create one nation because they knew what we know We are stronger together Hillary,Founders came together create one nation knew know stronger together Hillary
1535,1,As of tomorrow we have 100 days to make our case to America So what better place to kick off this campaign than where it all started,tomorrow 100 days make case America better place kick campaign started
1536,1,This has been such an excitingweek! We heard the man from Hope Bill Clinton amp the man of hope Barack Obama,excitingweek! heard man Hope Bill Clinton amp man hope Barack Obama
1537,1,Hillary amp TimKaine take the stage in Philadelphia at their first campaign rally as the official Democratic ticket,Hillary amp TimKaine take stage Philadelphia first campaign rally official Democratic ticket
1538,0,Wow my campaign is hearing from more and more Bernie supporters that they will NEVER support Crooked Hillary She sold them out VP pick!,Wow campaign hearing Bernie supporters NEVER support Crooked Hillary sold VP pick!
1539,0,In Hillary Clintons America things get worse TrumpPence16,Hillary Clintons America things get worse TrumpPence16
1540,0,The dishonest media didnt mention that Bernie Sanders was very angry looking during Crookeds speech He wishes he didnt make that deal!,dishonest media didnt mention Bernie Sanders angry looking Crookeds speech wishes didnt make deal!
1541,0,Thank you! Facebook Instagram,Thank you! Facebook Instagram
1542,1,Lets look to the future with courage and confidence Lets build a better tomorrow for our beloved children,Lets look future courage confidence Lets build better tomorrow beloved children
1543,0,Crooked Hillary said that I couldnt handle the rough and tumble of a political campaign ReallyI just beat 16 people and am beating her!,Crooked Hillary said couldnt handle rough tumble political campaign ReallyI beat 16 people beating her!
1544,0,If Michael Bloomberg ran again for Mayor of New York he wouldnt get 10 of the vote they would run him out of town! NeverHillary,Michael Bloomberg ran Mayor New York wouldnt get 10 vote would run town! NeverHillary
1545,0,Little Michael Bloomberg who never had the guts to run for president knows nothing about me His last term as Mayor was a disaster!,Little Michael Bloomberg never guts run president knows nothing last term Mayor disaster!
1546,0,General John Allen who I never met but spoke against me last night failed badly in his fight against ISIS His record BAD NeverHillary,General John Allen never met spoke last night failed badly fight ISIS record BAD NeverHillary
1547,0,Crooked Hillary Clinton mentioned me 22 times in her very long and very boring speech Many of her statements were lies and fabrications!,Crooked Hillary Clinton mentioned 22 times long boring speech Many statements lies fabrications!
1548,0,Join mike_pence at the University of Northwestern Ohio tonight at 7pm Tickets,Join mike_pence University Northwestern Ohio tonight 7pm Tickets
1549,0,AnnCoulter I believe in science Dem code for were shutting down coal mines steel plants and any other remaining manufacturing,AnnCoulter believe science Dem code shutting coal mines steel plants remaining manufacturing
1550,0,CAMPAIGN STATEMENT,CAMPAIGN STATEMENT
1551,0,Two policemen just shot in San Diego one dead It is only getting worse People want LAW AND ORDER!,Two policemen shot San Diego one dead getting worse People want LAW ORDER!
1552,0,Crooked Hillary Clinton made up facts about me and forgot to mention the many problems of our country in her very average scream!,Crooked Hillary Clinton made facts forgot mention many problems country average scream!
1553,0,The media coverage this morning of the very average Clinton speech and Convention is a joke CNN and the little watched Morning_Joe SAD!,media coverage morning average Clinton speech Convention joke CNN little watched Morning_Joe SAD!
1554,1,The next presidentand her husband,next presidentand husband
1555,1,Lets go win this together,Lets go win together
1556,0,No one has worse judgement than Hillary Clinton corruption and devastation follows her wherever she goes,one worse judgement Hillary Clinton corruption devastation follows wherever goes
1557,0,Hillarys wars in the Middle East have unleashed destruction terrorism and ISIS across the world,Hillarys wars Middle East unleashed destruction terrorism ISIS across world
1558,0,Hillarys vision is a borderless world where working people have no power no jobs no safety,Hillarys vision borderless world working people power jobs safety
1559,0,Hillary will never reform Wall Street She is owned by Wall Street!,Hillary never reform Wall Street owned Wall Street!
1560,0,Our way of life is under threat by Radical Islam and Hillary Clinton cannot even bring herself to say the words,way life threat Radical Islam Hillary Clinton cannot even bring say words
1561,0,Hillarys refusal to mention Radical Islam as she pushes a 550 increase in refugees is more proof that she is unfit to lead the country,Hillarys refusal mention Radical Islam pushes 550 increase refugees proof unfit lead country
1562,1,Thank you,Thank
1563,1,In America were always stronger together,America always stronger together
1564,1,Yes the world is watching what we do Yes Americas destiny is ours to choose So lets be stronger together my fellow Americans!,Yes world watching Yes Americas destiny choose lets stronger together fellow Americans!
1565,1,We lost our mother a few years ago but I miss her every day And I still hear her voice urging me to keep working keep fighting for right,lost mother years ago miss every day still hear voice urging keep working keep fighting right
1566,1,She never let me back down from any challengeshe was right You have to stand up to bullies Hillary on advice from her mom Dorothy,never let back challengeshe right stand bullies Hillary advice mom Dorothy
1567,1,Every generation of Americans has come together to make our country freer fairer and stronger None of uscan do it alone Hillary,Every generation Americans come together make country freer fairer stronger None uscan alone Hillary
1568,1,Enough with the bigotry and bombast Donald Trumps not offering real change hes offering empty promises Hillary,Enough bigotry bombast Donald Trumps offering real change hes offering empty promises Hillary
1569,1,Heres the sad truth There is no other Donald Trump This is it Hillary,Heres sad truth Donald Trump Hillary
1570,1,Lets put ourselves in the shoes of young black amp Latino people who face the effects of systemic racism and feel their lives are disposable,Lets put shoes young black amp Latino people face effects systemic racism feel lives disposable
1571,1,I refuse to believe we cant find common ground here We have to heal the divides in our country Hillary,refuse believe cant find common ground heal divides country Hillary
1572,1,We need to start listening to each other Hearing each other Walking in each others shoes,need start listening Hearing Walking others shoes
1573,1,Im not here to take away your guns I just dont want you to be shot by someone who shouldnt have a gun in the first place Hillary,Im take away guns dont want shot someone shouldnt gun first place Hillary
1574,1,If were serious about keeping our country safe we also cant afford to have a president whos in the pocket of the gun lobby Hillary,serious keeping country safe also cant afford president whos pocket gun lobby Hillary
1575,1,A man you can bait with a tweet is not a man we can trust with nuclear weapons Hillary,man bait tweet man trust nuclear weapons Hillary
1576,1,Donald Trump cant even handle the roughandtumble of a presidential campaignImagine him in the Oval Office facing a real crisis,Donald Trump cant even handle roughandtumble presidential campaignImagine Oval Office facing real crisis
1577,1,A president should respect the men and women who risk their lives to serve our country Hillary,president respect men women risk lives serve country Hillary
1578,1,Donald Trump says and this is a quote I know more about ISIS than the generals do No Donald you dont Hillary,Donald Trump says quote know ISIS generals Donald dont Hillary
1579,1,Im proud that we shaped a global climate agreement Now we have to hold every country accountable to their commitments Hillary,Im proud shaped global climate agreement hold every country accountable commitments Hillary
1580,1,Keeping our nation safe and honoring the people who do that work will be my highest priority Hillary,Keeping nation safe honoring people work highest priority Hillary
1581,1,Donald Trump says he wants to make America great againwell he could start by actually making things in America again Hillary,Donald Trump says wants make America great againwell could start actually making things America Hillary
1582,1,Please explain to me what part of America First leads him to make Trump ties in China not Colorado Trump suits in Mexico not Michigan,Please explain part America First leads make Trump ties China Colorado Trump suits Mexico Michigan
1583,1,Remember what the president said last night Dont boo vote! Hillary,Remember president said last night Dont boo vote! Hillary
1584,1,In Atlantic Cityyou will find contractors and small businesses who lost everything because Donald Trump refused to pay his bills Hillary,Atlantic Cityyou find contractors small businesses lost everything Donald Trump refused pay bills Hillary
1585,1,If you believe that every man woman amp child in America has the right to affordable health care join us! Hillary,believe every man woman amp child America right affordable health care join us! Hillary
1586,1,If fighting for affordable child care and paid family leave is playing the woman card then deal me in! Hillary,fighting affordable child care paid family leave playing woman card deal in! Hillary
1587,1,Way too many dreams die in the parking lots of banks In America if you can dream it you should be able to do it Hillary,Way many dreams die parking lots banks America dream able Hillary
1588,1,Bernie Sanders and I will work together to make college tuitionfree for the middle class and debtfree for all Hillary,Bernie Sanders work together make college tuitionfree middle class debtfree Hillary
1589,1,If you believe that your working mother wife sister or daughter deserve equal pay join us! Hillary,believe working mother wife sister daughter deserve equal pay join us! Hillary
1590,1,If you believe we should expand Social Security and protect a womans right to make her own heath care decisions join us! Hillary,believe expand Social Security protect womans right make heath care decisions join us! Hillary
1591,1,If you believe that companies should share profits with their workers not pad executive bonuses join us Hillary,believe companies share profits workers pad executive bonuses join us Hillary
1592,1,Comprehensive immigration reform will grow our economy and keep families together and its the right thing to do Hillary,Comprehensive immigration reform grow economy keep families together right thing Hillary
1593,1,When we have millions of hardworking immigrants contributing to our economy it would be selfdefeating and inhumane to kick them out,millions hardworking immigrants contributing economy would selfdefeating inhumane kick
1594,1,I believe that climate change is real and that we can save our planet while creating millions of goodpaying clean energy jobs Hillary,believe climate change real save planet creating millions goodpaying clean energy jobs Hillary
1595,1,Its wrong to take tax breaks with one hand and give out pink slips with the other Hillary,wrong take tax breaks one hand give pink slips Hillary
1596,1,Well pass a constitutional amendment to overturn Citizens United! Hillary,Well pass constitutional amendment overturn Citizens United! Hillary
1597,1,With your help I will carry all of your voices with us to the White House! Hillary,help carry voices us White House! Hillary
1598,1,I believe that our economy isnt working the way it should because our democracy isnt working the way it should Hillary,believe economy isnt working way democracy isnt working way Hillary
1599,1,My primary mission as president will be to create more opportunity and more good jobs with rising wages right here in the United States,primary mission president create opportunity good jobs rising wages right United States
1600,1,Democrats we are the party of working people Hillary,Democrats party working people Hillary
1601,1,When any barrier falls in America for anyone it clears the way for everyonewhen there are no ceilings the skys the limit Hillary,barrier falls America anyone clears way everyonewhen ceilings skys limit Hillary
1602,1,Weve reached a milestonethe first time that a major party has nominated a woman for president Hillary,Weve reached milestonethe first time major party nominated woman president Hillary
1603,1,I will be a president for Democrats Republicans and Independents For the struggling the striving and the successfulfor all Americans,president Democrats Republicans Independents struggling striving successfulfor Americans
1604,1,Its true I sweat the details of policybecause its not just a detail if its your kid if its your family Its a big deal,true sweat details policybecause detail kid family big deal
1605,1,Simply caring is not enough To drive real progress you have to change both hearts and laws Hillary,Simply caring enough drive real progress change hearts laws Hillary
1606,1,No one gets through life alone We have to look out for each other and lift each other up Hillary,one gets life alone look lift Hillary
1607,1,I accept your nomination for president of the United States! Hillary,accept nomination president United States! Hillary
1608,1,Through all these years of public service the service part has always come easier to me than the public part Hillary,years public service service part always come easier public part Hillary
1609,1,It is with humility determination and boundless confidence in Americas promise that I accept your nomination for president! Hillary,humility determination boundless confidence Americas promise accept nomination president! Hillary
1610,1,Stronger Together isnot just a slogan for our campaign Its a guiding principle for the country weve always been Hillary,Stronger Together isnot slogan campaign guiding principle country weve always Hillary
1611,1,None of us can raise a family build a business heal a community or lift a country totally alone Hillary StrongerTogether,None us raise family build business heal community lift country totally alone Hillary StrongerTogether
1612,1,Americans dont say I alone can fix it They say Well fix it together! Hillary,Americans dont say alone fix say Well fix together! Hillary
1613,1,Dont believe anyone who says I alone can fix it Yes those were actually Donald Trumps words in Cleveland Hillary,Dont believe anyone says alone fix Yes actually Donald Trumps words Cleveland Hillary
1614,1,Dont let anyone tell you that our country is weakwere not Dont let anyone tell you we dont have what it takeswe do,Dont let anyone tell country weakwere Dont let anyone tell dont takeswe
1615,1,We have the most dynamic and diverse people in the world We have the most tolerant and generous young people weve ever had Hillary,dynamic diverse people world tolerant generous young people weve ever Hillary
1616,1,We will not ban a religionwe will work with all Americans and our allies to fight and defeat terrorism Hillary,ban religionwe work Americans allies fight defeat terrorism Hillary
1617,1,We will not build a wallinstead we will build an economy where everyone who wants a good job can get one Hillary,build wallinstead build economy everyone wants good job get one Hillary
1618,1,FDR came up with the perfect rebuke to Donald Trump more than 80 years ago The only thing we have to fear is fear itself,FDR came perfect rebuke Donald Trump 80 years ago thing fear fear
1619,1,Hes taken the Republican Party a long way from Morning in America to Midnight in America Hillary on Trump,Hes taken Republican Party long way Morning America Midnight America Hillary Trump
1620,1,We heard Donald Trumps answer last week at his convention He wants to divide usHe wants us to fear the future and fear each other,heard Donald Trumps answer last week convention wants divide usHe wants us fear future fear
1621,1,We have to decide whether were going to work together so we can all rise together Hillary,decide whether going work together rise together Hillary
1622,1,Our Founders embraced the enduring truth that we are stronger together Hillary,Founders embraced enduring truth stronger together Hillary
1623,1,BernieSanders youve put economic and social justice issues front and center where they belong Hillary,BernieSanders youve put economic social justice issues front center belong Hillary
1624,1,To all of your supporters here and around the country I want you to know Ive heard you Hillary on BernieSanders,supporters around country want know Ive heard Hillary BernieSanders
1625,1,I want to thank Bernie Sanders Bernie your campaign inspired millions of Americans Hillary,want thank Bernie Sanders Bernie campaign inspired millions Americans Hillary
1626,1,For those of you out there who are just getting to know TimKainehell make the whole country proud as our vice president Hillary,getting know TimKainehell make whole country proud vice president Hillary
1627,1,We heard fromJoeBiden He spoke from his big heart about our partys commitment to working people Hillary,heard fromJoeBiden spoke big heart partys commitment working people Hillary
1628,1,America is stronger because of President Obamas leadership and I am better because of his friendship Hillary,America stronger President Obamas leadership better friendship Hillary
1629,1,We heard the man from Hope Bill Clinton And the man of hope Barack Obama Hillary,heard man Hope Bill Clinton man hope Barack Obama Hillary
1630,1,Bill that conversation we started in the law library 45 years ago it is still going strong Hillary,Bill conversation started law library 45 years ago still going strong Hillary
1631,1,Chelsea thank you I am so proud to be your mother and so proud of the woman youve become Hillary,Chelsea thank proud mother proud woman youve become Hillary
1632,0,Departing now thank you Cedar Rapids Iowa This is a MOVEMENT!,Departing thank Cedar Rapids Iowa MOVEMENT!
1633,1,Regardless of what was happening in her life she was always always there for me ChelseaClinton,Regardless happening life always always ChelseaClinton
1634,1,Mom Grandma would be so so proud of you tonight ChelseaClinton,Mom Grandma would proud tonight ChelseaClinton
1635,1,This November Im voting for a womanwho knows womens rights are human rightshere at home and around the world ChelseaClinton,November Im voting womanwho knows womens rights human rightshere home around world ChelseaClinton
1636,1,People ask me all the time How does she do itHeres how Its because she never ever forgets who shes fighting for ChelseaClinton,People ask time itHeres never ever forgets shes fighting ChelseaClinton
1637,1,She always feels like there isnt a moment to lose because she knows that for that mother for that family there isnt ChelseaClinton,always feels like isnt moment lose knows mother family isnt ChelseaClinton
1638,1,So proud,proud
1639,1,Im here as a proud American a proud Democrat a proud mother and tonight in particular a very very proud daughter ChelseaClinton,Im proud American proud Democrat proud mother tonight particular proud daughter ChelseaClinton
1640,1,Getting ready,Getting ready
1641,1,Thats rightI love Hillary too KatyPerry,Thats rightI love Hillary KatyPerry
1642,1,About to head out and accept your nomination for president Im so grateful to everyone who made this moment possible H,head accept nomination president Im grateful everyone made moment possible H
1643,1,Get the latest from the DemConvention floor before Hillary takes the stage,Get latest DemConvention floor Hillary takes stage
1644,1,Watch live Get an exclusive look at the DemConvention before Hillary officially accepts the nomination,Watch live Get exclusive look DemConvention Hillary officially accepts nomination
1645,1,Some issues are not left vs right or liberal vs conservative they are right vs wrong Rev William Barber,issues left vs right liberal vs conservative right vs wrong Rev William Barber
1646,1,When Flints water poisons its children it hurts all of us These are our children JenGranholm,Flints water poisons children hurts us children JenGranholm
1647,1,A night well never forget,night well never forget
1648,1,Its all happening Tune in for an exclusive look at the DemsInPhilly as Hillary officially accepts the nomination,happening Tune exclusive look DemsInPhilly Hillary officially accepts nomination
1649,0,CrookedHillary,CrookedHillary
1650,1,Her words gave me strength during one of the toughest tests of my life Clairecmc on Hillary,words gave strength one toughest tests life Clairecmc Hillary
1651,0,Dems warn not to underestimate Trumps potential win,Dems warn underestimate Trumps potential win
1652,0,Great to be back in Iowa! TBT with JerryJrFalwell joining me in Davenport this past winter MAGA,Great back Iowa! TBT JerryJrFalwell joining Davenport past winter MAGA
1653,0,Median household income is down for the middle class since Obama took office It will only go further down under Clinton,Median household income middle class since Obama took office go Clinton
1654,0,A vote for ClintonKaine is a vote for TPP NAFTA high taxes radical regulation and massive influx of refugees,vote ClintonKaine vote TPP NAFTA high taxes radical regulation massive influx refugees
1655,0,AMERICAS FUTURE,AMERICAS FUTURE
1656,1,No matter how daunting the odds no matter how much people try to knock her down she never ever quits POTUS,matter daunting odds matter much people try knock never ever quits POTUS
1657,0,Bernie caved!,Bernie caved!
1658,0,LallyRay Poll Donald Trump Sees 17Point Positive Swing in Two Weeks Breitbart realdonaldtrump Great!,LallyRay Poll Donald Trump Sees 17Point Positive Swing Two Weeks Breitbart realdonaldtrump Great!
1659,1,Ready to pass the baton,Ready pass baton
1660,1,On day three the DemsInPhilly officially welcomed TimKaine to the ticketand POTUS brought down the house,day three DemsInPhilly officially welcomed TimKaine ticketand POTUS brought house
1661,1,I ask you to do for Hillary Clinton what you did for me I ask you to carry her the same way you carried me,ask Hillary Clinton ask carry way carried
1662,0,President Obama spoke last night about a world that doesnt exist 70 of the people think our country is going in the wrong direction DNC,President Obama spoke last night world doesnt exist 70 people think country going wrong direction DNC
