,handle,text,cleantext
0,1,The question in this election Who can put the plans into action that will make your life better,question election put plans action make life better
1,1,If we stand together theres nothing we cant do Make sure youre ready to vote,stand together theres nothing cant Make sure youre ready vote
2,1,Both candidates were asked about how theyd confront racial injustice Only one had a real answer,candidates asked theyd confront racial injustice one real answer
3,0,Join me for a 3pm rally tomorrow at the MidAmerica Center in Council Bluffs Iowa! Tickets,Join 3pm rally tomorrow MidAmerica Center Council Bluffs Iowa! Tickets
4,1,This election is too important to sit out Go to and make sure youre registered NationalVoterRegistrationDay H,election important sit Go make sure youre registered NationalVoterRegistrationDay H
5,1,When Donald Trump goes lowregister to vote,Donald Trump goes lowregister vote
6,0,Once again we will have a government of by and for the people Join the MOVEMENT today!,government people Join MOVEMENT today!
7,0,Hillary Clintons Campaign Continues To Make False Claims About Foundation Disclosure,Hillary Clintons Campaign Continues Make False Claims Foundation Disclosure
8,0,CNBC Time magazine online polls say Donald Trump won the first presidential debate via WashTimes MAGA,CNBC Time magazine online polls say Donald Trump first presidential debate via WashTimes MAGA
9,1,Donald Trump lied to the American people at least 58 times during the first presidential debate We counted,Donald Trump lied American people least 58 times first presidential debate counted
10,0,Great afternoon in Little Havana with Hispanic community leaders Thank you for your support! ImWithYou,Great afternoon Little Havana Hispanic community leaders Thank support! ImWithYou
11,0,In the last 24 hrs we have raised over 13M from online donations and National Call Day and were still going! Thank you America! MAGA,last 24 hrs raised 13M online donations National Call Day still going! Thank America! MAGA
12,1,She gained about 55 pounds in9 months She was like an eating machine Trump a man who wants to be president,gained 55 pounds in9 months like eating machine Trump man wants president
13,1,Its NationalVoterRegistrationDay Celebrate by registering to vote,NationalVoterRegistrationDay Celebrate registering vote
14,1,I love this country Im proud of this country I want to be a leader who brings people together Hillary LoveTrumpsHate,love country Im proud country want leader brings people together Hillary LoveTrumpsHate
15,1,We dont want to turn against each other We want to work with one another We want to set big goals in this country StrongerTogether,dont want turn want work one another want set big goals country StrongerTogether
16,1,What we hear from my opponent is dangerously incoherent Its unclear what hes saying but words matter Hillary,hear opponent dangerously incoherent unclear hes saying words matter Hillary
17,1,One candidate made it clear he wasnt prepared for last nights debate The other made it clear shes prepared to b,One candidate made clear wasnt prepared last nights debate made clear shes prepared b
18,1,What kind of a person would want to root for 9 million families losing their homes One who should never be president Hillary on Trump,kind person would want root 9 million families losing homes One never president Hillary Trump
19,1,I dont think that any family should have to pay more than 10 of their income on child care Hillary,dont think family pay 10 income child care Hillary
20,1,Im really glad my dad never had a contract with Donald Trump Hillary,Im really glad dad never contract Donald Trump Hillary
21,1,When you work hard you should not be living in poverty,work hard living poverty
22,0,Well now theyre saying that I not only won the NBC Presidential Forum but last night the big debate Nice!,Well theyre saying NBC Presidential Forum last night big debate Nice!
23,1,We may have a recordsetting turnout in this election We could have the biggest turnout weve ever had,may recordsetting turnout election could biggest turnout weve ever
24,1,You can go to to make sure you are registered And I hope you all will Hillary NationalVoterRegistrationDay,go make sure registered hope Hillary NationalVoterRegistrationDay
25,1,Join Hillary live in NC for her first rally since winning last nights debate NationalVoterRegistrationDay,Join Hillary live NC first rally since winning last nights debate NationalVoterRegistrationDay
26,1,Donald just criticized me for preparing for this debate And you know what else I prepared for I prepared to be,Donald criticized preparing debate know else prepared prepared
27,0,Thank you for your endorsement GovernorSununu MAGA,Thank endorsement GovernorSununu MAGA
28,1,Hillary was the winner of the first presidential debateand newspapers across America agree SheWon,Hillary winner first presidential debateand newspapers across America agree SheWon
29,1,She gained a massive amount of weightit was a real problem Trump this morning on Alicia Machado,gained massive amount weightit real problem Trump morning Alicia Machado
30,1,When you have a really really good night SheWon,really really good night SheWon
31,0,Such a great honor Final debate polls are in and the MOVEMENT wins! AmericaFirst MAGA ImWithYou,great honor Final debate polls MOVEMENT wins! AmericaFirst MAGA ImWithYou
32,1,Register Vote Go out and get engaged! JoeBiden NationalVoterRegistrationDay,Register Vote Go get engaged! JoeBiden NationalVoterRegistrationDay
33,1,Im glad Trump found out that Crimea was part of Ukraine By the way I heard he was on the verge of acknowledging gravity JoeBiden,Im glad Trump found Crimea part Ukraine way heard verge acknowledging gravity JoeBiden
34,1,Let me tell you who built this damn country the middle class JoeBiden Lets keep building it together,Let tell built damn country middle class JoeBiden Lets keep building together
35,1,One moment last night that provedagainthat Hillarys the only candidate ready to lead on the global stage SheWon,One moment last night provedagainthat Hillarys candidate ready lead global stage SheWon
36,0,US Murders Increased 108 in 2015 via WSJ,US Murders Increased 108 2015 via WSJ
37,1,Anyone who complains about microphone problems is not having a good night Hillary SheWon,Anyone complains microphone problems good night Hillary SheWon
38,0,Thank you! TrumpWon MAGA,Thank you! TrumpWon MAGA
39,0,Hillarys been failing for 30 years in not getting the job done it will never change,Hillarys failing 30 years getting job done never change
40,1,Trump on Alicia 1996 Miss Piggy This morning She gained a massive amount of weightit was a real problem,Trump Alicia 1996 Miss Piggy morning gained massive amount weightit real problem
41,0,True bluecollar billionaire Donald Trump shows Hillary Clinton is out of touch,True bluecollar billionaire Donald Trump shows Hillary Clinton touch
42,0,The 1 trend on Twitter right now is TrumpWon thank you!,1 trend Twitter right TrumpWon thank you!
43,0,I won every poll from last nights Presidential Debate except for the little watched CNN poll,every poll last nights Presidential Debate except little watched CNN poll
44,0,How Trump won over a bar full of undecideds and Democrats,Trump bar full undecideds Democrats
45,0,I really enjoyed the debate last nightCrooked Hillary says she is going to do so many thingsWhy hasnt she done them in her last 30 years,really enjoyed debate last nightCrooked Hillary says going many thingsWhy hasnt done last 30 years
46,1,I have a winning temperament Donald Trump last night Really SheWon,winning temperament Donald Trump last night Really SheWon
47,1,Only one person on last nights stage is prepared to be CommanderinChief Make sure she gets the chance,one person last nights stage prepared CommanderinChief Make sure gets chance
48,0,Great debate poll numbers I will be on foxandfriends at 700 to discuss Enjoy!,Great debate poll numbers foxandfriends 700 discuss Enjoy!
49,0,Thank you! Four new DebateNight polls with the MOVEMENT winning Together we will MAKE AMERICA SAFE amp GREAT AGAIN,Thank you! Four new DebateNight polls MOVEMENT winning Together MAKE AMERICA SAFE amp GREAT
50,0,DRUDGE_REPORTs First Presidential Debate Poll Trump 80 Clinton 20 Join the MOVEMENT today amp lets MAGA!,DRUDGE_REPORTs First Presidential Debate Poll Trump 80 Clinton 20 Join MOVEMENT today amp lets MAGA!
51,0,Thank you! CNBC DebateNight poll with over 400000 votes Trump 61 Clinton 39 AmericaFirst ImWithYou,Thank you! CNBC DebateNight poll 400000 votes Trump 61 Clinton 39 AmericaFirst ImWithYou
52,0,TIME DebateNight poll over 800000 votes Thank you! AmericaFirst MAGA,TIME DebateNight poll 800000 votes Thank you! AmericaFirst MAGA
53,0,newtgingrich just said a historic victory for Trump NICE!,newtgingrich said historic victory Trump NICE!
54,0,Wow did great in the debate polls except for CNN which I dont watch Thank you!,Wow great debate polls except CNN dont watch Thank you!
55,1,43 days left Lets go win this thing DebateNight,43 days left Lets go win thing DebateNight
56,0,Thank you Governor TerryBranstad! AmericaFirst Debates2016,Thank Governor TerryBranstad! AmericaFirst Debates2016
57,0,Thank you Governor Mike_Pence! Lets MAKE AMERICA SAFE AND GREAT AGAIN with the American people AmericaFirst,Thank Governor Mike_Pence! Lets MAKE AMERICA SAFE GREAT American people AmericaFirst
58,0,Thank you Senator TedCruz! Debates2016 MAGA,Thank Senator TedCruz! Debates2016 MAGA
59,1,DebateNight,DebateNight
60,1,Donald Trump called her Miss Piggy and Miss Housekeeping Her name is Alicia Machado DebateNight,Donald Trump called Miss Piggy Miss Housekeeping name Alicia Machado DebateNight
61,1,The presidency isnt a reality showits as real as it gets Make sure youre registered to vote,presidency isnt reality showits real gets Make sure youre registered vote
62,1,Text IMWITHHER to 47246 to tell Hillary youre on her team all the way to Election Day debatenight,Text IMWITHHER 47246 tell Hillary youre team way Election Day debatenight
63,1,RT this if youre proud to be standing with Hillary tonight debatenight,RT youre proud standing Hillary tonight debatenight
64,1,Hillary just proved shes the only candidate whos ready to be president Chip in now and lets go win this thing,Hillary proved shes candidate whos ready president Chip lets go win thing
65,0,HillaryClintons Nuclear Agreement Paved The Way For The 400 Million Ransom Payment DebateNight,HillaryClintons Nuclear Agreement Paved Way 400 Million Ransom Payment DebateNight
66,0,Nothing on emails Nothing on the corrupt Clinton Foundation And nothing on Benghazi Debates2016 debatenight,Nothing emails Nothing corrupt Clinton Foundation nothing Benghazi Debates2016 debatenight
67,1,When Donald Trump says he has a winning temperament debatenight,Donald Trump says winning temperament debatenight
68,1,The woman Trump called Miss Piggy has a name Alicia debatenight,woman Trump called Miss Piggy name Alicia debatenight
69,0,HillaryClinton Obama ISIS Strategy Has Allowed It To Expand To Become A Global Threat DebateNight,HillaryClinton Obama ISIS Strategy Allowed Expand Become Global Threat DebateNight
70,1,When Donald Trump spends 11 hours testifying in front of a congressional committee he can talk to me about stamina Hillary debatenight,Donald Trump spends 11 hours testifying front congressional committee talk stamina Hillary debatenight
71,1,Donald Trumps cavalier attitude about nuclear weapons is so deeply troubling DebateNight,Donald Trumps cavalier attitude nuclear weapons deeply troubling DebateNight
72,0,Russia has more warheads than ever N Korea is testing nukes and Iran got a sweetheart deal to keep theirs Thanks HillaryClinton,Russia warheads ever N Korea testing nukes Iran got sweetheart deal keep Thanks HillaryClinton
73,1,realDonaldTrump Barack Obama is your president too debatenight,realDonaldTrump Barack Obama president debatenight
74,1,A man who can be provoked by a tweet should not have his hands anywhere near the nuclear codes DebateNight,man provoked tweet hands anywhere near nuclear codes DebateNight
75,0,Hillary Clinton failed all over the world LIBYA SYRIA IRAN IRAQ ASIA PIVOT RUSSIAN RESET BENGHAZI,Hillary Clinton failed world LIBYA SYRIA IRAN IRAQ ASIA PIVOT RUSSIAN RESET BENGHAZI
76,1,This should go without saying Taking nuclear war lightly is disqualifying for anyone seeking to be President of th,go without saying Taking nuclear war lightly disqualifying anyone seeking President th
77,0,Hillary Clinton is the only candidate on stage who voted for the Iraq War Debates2016 MAGA,Hillary Clinton candidate stage voted Iraq War Debates2016 MAGA
78,0,HillaryClintons 2008 Campaign And Supporters Trafficked In Rumors About Obamas Heritage DebateNight,HillaryClintons 2008 Campaign Supporters Trafficked Rumors Obamas Heritage DebateNight
79,1,I hope the factcheckers are turning up the volume Donald Trump supported the invasion of Iraq,hope factcheckers turning volume Donald Trump supported invasion Iraq
80,1,What is the deal with Donald Trump and Russia debatenight,deal Donald Trump Russia debatenight
81,1,When Donald Trump goes low we go high DebateNight,Donald Trump goes low go high DebateNight
82,1,When a man is sued for discriminating against black tenants amp pushes birtherism hes giving you an idea of what kind of president hed be,man sued discriminating black tenants amp pushes birtherism hes giving idea kind president hed
83,1,Donald Trumps answer for his five years of pushing the racist birther conspiracy theory I say nothing debatenight,Donald Trumps answer five years pushing racist birther conspiracy theory say nothing debatenight
84,1,Trump just criticized me for preparing for this debate You know what else I prepared for Being president DebateNight,Trump criticized preparing debate know else prepared president DebateNight
85,1,President Obama was born in the United States Hes American Trump only has one reason for refusing to admit it debatenight,President Obama born United States Hes American Trump one reason refusing admit debatenight
86,1,Still a complete lie DebateNight,Still complete lie DebateNight
87,1,Donald Trump is more concerned with pandering to the gun lobby than keeping families safe DebateNight,Donald Trump concerned pandering gun lobby keeping families safe DebateNight
88,1,The fact that Trumps answer to a question about racial injustice is just we need law and order pretty much says it all debatenight,fact Trumps answer question racial injustice need law order pretty much says debatenight
89,1,Weve got to address the systemic racism in our criminal justice system and end private prisons DebateNight,Weve got address systemic racism criminal justice system end private prisons DebateNight
90,0,I will stand with police and protect ALL Americans! Debates2016 MAGA,stand police protect Americans! Debates2016 MAGA
91,1,We are not going to bring New Yorks unconstitutional stopandfrisk program nationwide debatenight,going bring New Yorks unconstitutional stopandfrisk program nationwide debatenight
92,1,Maybe he didnt do a good job Donald Trump Looks like you loved it at the time DebateNight,Maybe didnt good job Donald Trump Looks like loved time DebateNight
93,1,Its about time this country had somebody running it who has an idea about money Trump debatenight,time country somebody running idea money Trump debatenight
94,1,Paying zero in taxes doesnt make you smart It makes you a tax evader,Paying zero taxes doesnt make smart makes tax evader
95,1,No wonder Donald Trump is hiding his tax returns debatenight,wonder Donald Trump hiding tax returns debatenight
96,0,This is the simple fact about HillaryClinton she is a typical politician all talk no action Debates2016,simple fact HillaryClinton typical politician talk action Debates2016
97,0,HILLARYS BAD TAX HABIT!,HILLARYS BAD TAX HABIT!
98,0,A Clinton economy more taxes and more spending! DebateNight,Clinton economy taxes spending! DebateNight
99,0,HillaryClinton has been part of the rigged DC system for 30 years Why would we take policy advice from her Debates2016,HillaryClinton part rigged DC system 30 years would take policy advice Debates2016
100,0,Instead of driving jobs and wealth away AMERICA will become the worlds great magnet for innovation and job creati,Instead driving jobs wealth away AMERICA become worlds great magnet innovation job creati
101,1,Donald Trump may live in his own realitybut weve got his own words right here Check them out debatenight,Donald Trump may live realitybut weve got words right Check debatenight
102,0,HillaryClinton channels John Kerry on trade she was for bad trade deals before she was against them TPP Debates2016,HillaryClinton channels John Kerry trade bad trade deals TPP Debates2016
103,1,We can step up and confront climate change save our planet and invest in clean energy Or we can do nothing,step confront climate change save planet invest clean energy nothing
104,1,I never said that Donald Trump who said that debatenight,never said Donald Trump said debatenight
105,1,Thats called business Donald Trump on the housing crash For millions of Americans it was called losing their home DebateNight,Thats called business Donald Trump housing crash millions Americans called losing home DebateNight
106,0,HillaryClinton and Obama policies increased debt by 9trillion over the last 8 years,HillaryClinton Obama policies increased debt 9trillion last 8 years
107,1,Economists project that Trumps plans would add more than 5000000000000 to the national debt Thats trillion with a T,Economists project Trumps plans would add 5000000000000 national debt Thats trillion
108,1,Every time Trump makes a show of railing against outsourcing remember the countries he shipped jobs and profits to,Every time Trump makes show railing outsourcing remember countries shipped jobs profits
109,1,Having a small business owner for a dad may not get you multimilliondollar bailouts but it does teach you the va,small business owner dad may get multimilliondollar bailouts teach va
110,1,Theres only one candidate on stage who will support working families DebateNight,Theres one candidate stage support working families DebateNight
111,1,We have to build an economy that works for everyone not just those at the top DebateNight,build economy works everyone top DebateNight
112,1,Watch live Hillary takes the stage for the first presidential debate DebateNight,Watch live Hillary takes stage first presidential debate DebateNight
113,1,Lets do this DebateNight,Lets DebateNight
114,0,Why isnt Hillary Clinton 50 points ahead DebateNight,isnt Hillary Clinton 50 points ahead DebateNight
115,1,If youre with Hillary nows the time to show it Chip in before tonights debate to have her back DebateNight,youre Hillary nows time show Chip tonights debate back DebateNight
116,1,No matter what Donald says at tonights debate we already know the real Trump Follow TheBriefing2016 for the fa,matter Donald says tonights debate already know real Trump Follow TheBriefing2016 fa
117,1,Hillarys set to take the debate stage at 9pm ET Heres where you can watch DebateNight,Hillarys set take debate stage 9pm ET Heres watch DebateNight
118,1,You didnt blame Little John or Meat Loaf You fired Gary Busey These are the kinds of decisions that would keep,didnt blame Little John Meat Loaf fired Gary Busey kinds decisions would keep
119,0,My team of deplorables will be managing my Twitter account for this evenings debate Tune in! DebateNight TrumpPence16,team deplorables managing Twitter account evenings debate Tune in! DebateNight TrumpPence16
120,1,Here are 35 questions Trump still needs to answer DebateNight,35 questions Trump still needs answer DebateNight
121,1,Watch this before you watch tonights debate DebateNight,Watch watch tonights debate DebateNight
122,1,Trump told 31 outright lies just last week Keep him honest at tonights debate Follow TheBriefing2016 to get th,Trump told 31 outright lies last week Keep honest tonights debate Follow TheBriefing2016 get th
123,1,Our presidents are role models for generations of our children Is this the example we want for them NYTimes,presidents role models generations children example want NYTimes
124,1,These headlines on Trumps lies are from just one week of his campaign Imagine four years of his presidency,headlines Trumps lies one week campaign Imagine four years presidency
125,1,Everything you need to know before watching tonights debate,Everything need know watching tonights debate
126,1,Tonight Hillary will debate Trump for the first time Follow TheBriefing2016 to make sure hes held accountable to the facts DebateNight,Tonight Hillary debate Trump first time Follow TheBriefing2016 make sure hes held accountable facts DebateNight
127,1,A reminder heading into tonights debate DebateNight,reminder heading tonights debate DebateNight
128,1,Donald Trump is a man who dwells in bigotry bluster and false promises NYTimes DebateNight,Donald Trump man dwells bigotry bluster false promises NYTimes DebateNight
129,1,Our daughters deserve better,daughters deserve better
130,1,Not a single living president has endorsed Donald Trump,single living president endorsed Donald Trump
131,1,Trump cant win tonights debate by lying to the American people,Trump cant win tonights debate lying American people
132,1,RT this if youve got Hillarys back tonight Debates2016,RT youve got Hillarys back tonight Debates2016
133,0,New national Bloomberg poll just released thank you! Join the MOVEMENT TrumpTrain,New national Bloomberg poll released thank you! Join MOVEMENT TrumpTrain
134,1,When we come together theres no problem we cant solve and no divide we cant heal,come together theres problem cant solve divide cant heal
135,0,Really sad news The great Arnold Palmer the King has died There was noone like him a true champion! He will be truly missed,Really sad news great Arnold Palmer King died noone like true champion! truly missed
136,1,Today the sacrifices of Gold Star families weigh heavier on my mind Thank you I will fight to get you the care amp benefits you deserve H,Today sacrifices Gold Star families weigh heavier mind Thank fight get care amp benefits deserve H
137,0,Five people killed in Washington State by a Middle Eastern immigrant Many people died this weekend in Ohio from drug overdoses NC riots!,Five people killed Washington State Middle Eastern immigrant Many people died weekend Ohio drug overdoses NC riots!
138,1,59 years ago 9 brave students integrated Central High School changing the course of history Lets recommit to fi,59 years ago 9 brave students integrated Central High School changing course history Lets recommit fi
139,1,Lets send Donald Trumpand the worlda clear message LoveTrumpsHate,Lets send Donald Trumpand worlda clear message LoveTrumpsHate
140,1,Imagine Donald Trump sitting in the Situation Room making life or death decisions on behalf of the United States,Imagine Donald Trump sitting Situation Room making life death decisions behalf United States
141,1,Hillary is one of the most qualified people ever to run for the office and she easily earns our endorsement,Hillary one qualified people ever run office easily earns endorsement
142,1,Our veterans and their families deserve a president who doesnt disrespect and disparage their sacrifices,veterans families deserve president doesnt disrespect disparage sacrifices
143,0,Readout of my meeting with Israeli Prime Minister Benjamin Netanyahu,Readout meeting Israeli Prime Minister Benjamin Netanyahu
144,1,7 ways Hillarys policies would help you in your daily life,7 ways Hillarys policies would help daily life
145,1,Gold Star families have made sacrifices most of us cant even fathom They deserve our respect and our thanks,Gold Star families made sacrifices us cant even fathom deserve respect thanks
146,1,Not one living president has said they believe Donald Trump has what it takes to be CommanderinChief,one living president said believe Donald Trump takes CommanderinChief
147,1,Meet three women who inspired Hillary to become the person she is today,Meet three women inspired Hillary become person today
148,0,Looking forward to my meeting with Benjamin Netanyahu in Trump Tower at 1000 AM,Looking forward meeting Benjamin Netanyahu Trump Tower 1000
149,1,Our endorsement is rooted in respect for her intellect experience toughness and courage NYTimes on Hillary,endorsement rooted respect intellect experience toughness courage NYTimes Hillary
150,0,Bernie Sanders gave Hillary the Dem nomination when he gave up on the emails That issue has only gotten bigger!,Bernie Sanders gave Hillary Dem nomination gave emails issue gotten bigger!
151,0,Many on the team and staff of Bernie Sanders have been treated badly by the Hillary Clinton campaign and they like Trump on trade a lot!,Many team staff Bernie Sanders treated badly Hillary Clinton campaign like Trump trade lot!
152,1,The new NMAAHC is an overdue tribute to African American history Lets build a more open inclusive future by reflecting on our past H,new NMAAHC overdue tribute African American history Lets build open inclusive future reflecting past H
153,0,Thank you Roanoke Virginia this a MOVEMENT join us today! Sign up AmericaFirst,Thank Roanoke Virginia MOVEMENT join us today! Sign AmericaFirst
154,1,Our choice Hillary Clinton has a record of service and a raft of pragmatic ideas NYTimes endorsing Hillary,choice Hillary Clinton record service raft pragmatic ideas NYTimes endorsing Hillary
155,1,I thought this womanI want to ride with her Roxie a Republican and small business owner on meeting Hillary,thought womanI want ride Roxie Republican small business owner meeting Hillary
156,1,Hillarys been fighting for women and girls her entire careerand shes just getting started,Hillarys fighting women girls entire careerand shes getting started
