,handle,text,cleantext
4161,0,Lyin Ted Cruz even voted against Superstorm Sandy aid and September 11th help So many New Yorkers devastated Cruz hates New York!,Lyin Ted Cruz even voted Superstorm Sandy aid September 11th help many New Yorkers devastated Cruz hates New York!
4162,1,She promised me to block the Constitutional amendment against gay marriage And she did,promised block Constitutional amendment gay marriage
4163,1,Its time to create a path to full and equal citizenship and finally fix our broken immigration system FightForFamilies H,time create path full equal citizenship finally fix broken immigration system FightForFamilies H
4164,1,We need comprehensive immigration reform now Ill propose legislation within my first 100 days as president H,need comprehensive immigration reform Ill propose legislation within first 100 days president H
4165,1,I will protect President Obamas executive actions to keep these families together and go even further to bring more families relief H,protect President Obamas executive actions keep families together go even bring families relief H
4166,1,Millions of families who call America home live in fear of being torn apart by deportation Today SCOTUS begins deciding their fate H,Millions families call America home live fear torn apart deportation Today SCOTUS begins deciding fate H
4167,1,To everyone in Houston please stay safe and avoid traveling Our prayers are with you HoustonFlood H,everyone Houston please stay safe avoid traveling prayers HoustonFlood H
4168,0,New York we will make America great again!,New York make America great again!
4169,1,No child should have to live in fear of losing her parents to deportation FightForFamilies,child live fear losing parents deportation FightForFamilies
4170,1,TomColicchio thanks for your work on this issue Your zip code shouldnt determine your ability to access healthy affordable food,TomColicchio thanks work issue zip code shouldnt determine ability access healthy affordable food
4171,1,Anything is possible Do not let where you come from dictate your life How one New York school is changing lives,Anything possible let come dictate life one New York school changing lives
4172,0,Kasich only looks OK in polls against Hillary because nobody views him as a threat and therefore have placed ZERO negative ads against him,Kasich looks OK polls Hillary nobody views threat therefore placed ZERO negative ads
4173,0,Lyin Ted Cruz cant win with the voters so he has to sell himself to the bossesI am millions of VOTES ahead! Hillary would destroy him amp K,Lyin Ted Cruz cant win voters sell bossesI millions VOTES ahead! Hillary would destroy amp K
4174,0,DiamondandSilk realDonaldTrump is who we need 2 fix this corrupted rigged system 4 no Profit Under budget amp ahead of schedule,DiamondandSilk realDonaldTrump need 2 fix corrupted rigged system 4 Profit budget amp ahead schedule
4175,1,If we stand up for our values instead of turning to division and hate theres nothing we cant do,stand values instead turning division hate theres nothing cant
4176,0,Thank you for todays endorsement New York Veteran Police Association! NewYorkValues,Thank todays endorsement New York Veteran Police Association! NewYorkValues
4177,0,Thank you California! Will see you soon! MakeAmericaGreatAgain,Thank California! see soon! MakeAmericaGreatAgain
4178,1,Our hearts go out to the people of Ecuador and the families who lost loved ones from yesterdays earthquake H,hearts go people Ecuador families lost loved ones yesterdays earthquake H
4179,1,A great day in East Harlem in photos,great day East Harlem photos
4180,0,I would have millions of votes more than Hillary except for the fact that I had 17 opponents and she just had a socialist named Bernie!,would millions votes Hillary except fact 17 opponents socialist named Bernie!
4181,0,Crooked Hillary Clinton is spending a fortune on ads against me I am the one person she doesnt want to run against Will be such fun!,Crooked Hillary Clinton spending fortune ads one person doesnt want run fun!
4182,0,Lyin Ted Cruz cant get votes I am millions ahead of him so he has to get his delegates from the Republican bosses It wont work!,Lyin Ted Cruz cant get votes millions ahead get delegates Republican bosses wont work!
4183,0,Lyin Ted Cruz will never be able to beat Hillary Despite a rigged delegate system I am hundreds of delegates ahead of him,Lyin Ted Cruz never able beat Hillary Despite rigged delegate system hundreds delegates ahead
4184,0,Ill be in one of my favorite places this morning Staten Island Big crowd will be fun!,Ill one favorite places morning Staten Island Big crowd fun!
4185,0,MakeAmericaGreatAgain NYPrimary,MakeAmericaGreatAgain NYPrimary
4186,0,Thank you California Connecticut Maryland and Pennsylvania! MakeAmericaGreatAgain Trump2016,Thank California Connecticut Maryland Pennsylvania! MakeAmericaGreatAgain Trump2016
4187,0,See you tomorrow Dutchess County New York! NYPrimary TrumpTrain,See tomorrow Dutchess County New York! NYPrimary TrumpTrain
4188,0,Will be on Hannity tonight Rebroadcast of town hall from Pittsburgh PA 800pm on FOX Enjoy! Trump2016,Hannity tonight Rebroadcast town hall Pittsburgh PA 800pm FOX Enjoy! Trump2016
4189,0,Ollie_621 FoxNews realDonaldTrump I think its more like 64 VoteTrumpNY MakeAmericaGreatAgain!,Ollie_621 FoxNews realDonaldTrump think like 64 VoteTrumpNY MakeAmericaGreatAgain!
4190,0,AshleyEdam New CBS Poll shows defections from Cruzs core supporters amp increased support for realDonaldTrump Not surprising,AshleyEdam New CBS Poll shows defections Cruzs core supporters amp increased support realDonaldTrump surprising
4191,0,Trumptbird Dear Im starting to believe that youre actually going to WIN! Trump2016 presidenttrump primary,Trumptbird Dear Im starting believe youre actually going WIN! Trump2016 presidenttrump primary
4192,0,Trump_Supporter Trump Holds 66 Favorable Rating in New York Leads Hillary Clinton by 19pts in Empire,Trump_Supporter Trump Holds 66 Favorable Rating New York Leads Hillary Clinton 19pts Empire
4193,0,THANK YOU SYRACUSE! NYPrimary,THANK SYRACUSE! NYPrimary
4194,0,Just arrived in Syracuse NY Big crowd great place! We will bring back the desperately needed jobs NYPrimary,arrived Syracuse NY Big crowd great place! bring back desperately needed jobs NYPrimary
4195,0,ICYMI foxandfriends this morning,ICYMI foxandfriends morning
4196,0,I will be interviewed on foxandfriends at 900 AM I will be talking about the rigged and boss controlled Republican primaries!,interviewed foxandfriends 900 talking rigged boss controlled Republican primaries!
4197,0,dmharvey89 realDonaldTrump wdct8110 I just voted for realDonaldTrump in Indiana Everyone I talk to was following suit! Fantastic!,dmharvey89 realDonaldTrump wdct8110 voted realDonaldTrump Indiana Everyone talk following suit! Fantastic!
4198,0,herb_stamper JackoffJosh711 SenFrankNiceley FoxNews WSJ we are becoming a third world country because of jerks like him Great!,herb_stamper JackoffJosh711 SenFrankNiceley FoxNews WSJ becoming third world country jerks like Great!
4199,0,wdct8110 realDonaldTrump We love you Donald ! Finally someone who actually cares about us !!,wdct8110 realDonaldTrump love Donald ! Finally someone actually cares us !!
4200,0,Bubble709_ realDonaldTrump Praying for your family and your win in New York Thank you!,Bubble709_ realDonaldTrump Praying family win New York Thank you!
4201,0,Join me this weekend! NYPrimary 416 SYRACUSE NOON 416 WATERTOWN 3pm Trump2016,Join weekend! NYPrimary 416 SYRACUSE NOON 416 WATERTOWN 3pm Trump2016
4202,0,Thank you NYPost! Trump2016,Thank NYPost! Trump2016
4203,0,Thank you America! Trump2016,Thank America! Trump2016
4204,0,MAKE AMERICA GREAT AGAIN!,MAKE AMERICA GREAT AGAIN!
4205,0,Join me on Saturday in Syracuse New York! NYPrimary Trump2016,Join Saturday Syracuse New York! NYPrimary Trump2016
4206,0,Thank you Pittsburgh Pennsylvania! MakeAmericaGreatAgain Trump2016,Thank Pittsburgh Pennsylvania! MakeAmericaGreatAgain Trump2016
4207,0,Big protest march in Colorado on Friday afternoon! Dont let the bosses take your vote!,Big protest march Colorado Friday afternoon! Dont let bosses take vote!
4208,0,The rules DID CHANGE in Colorado shortly after I entered the race in June because the pols and their bosses knew I would win with the voters,rules CHANGE Colorado shortly entered race June pols bosses knew would win voters
4209,0,Biggest story in politics is now happening in the great State of Colorado where over one million people have been precluded from voting!,Biggest story politics happening great State Colorado one million people precluded voting!
4210,0,Will be interviewed by SeanHannity on FoxNews tonight at 10pm from Pennsylvania Enjoy! Trump2016,interviewed SeanHannity FoxNews tonight 10pm Pennsylvania Enjoy! Trump2016
4211,0,Join me in Pittsburgh tonight at 7pmE! Trump2016 TrumpTrain Tickets,Join Pittsburgh tonight 7pmE! Trump2016 TrumpTrain Tickets
4212,0,MakeAmericaGreatAgain Trump2016,MakeAmericaGreatAgain Trump2016
4213,0,MakeAmericaGreatAgain Trump2016,MakeAmericaGreatAgain Trump2016
4214,0,Great to be on andersoncooper tonight with my wonderful family Will be rebroadcast at 1200 AM EASTERN,Great andersoncooper tonight wonderful family rebroadcast 1200 EASTERN
4215,0,I LOVE NEW YORK! NewYorkValues,LOVE NEW YORK! NewYorkValues
4216,0,THANK YOU California Maryland New York and Pennsylvania! See you soon! MakeAmericaGreatAgain Trump2016,THANK California Maryland New York Pennsylvania! See soon! MakeAmericaGreatAgain Trump2016
4217,0,Missouri just confirmed Trump2016 as the official winner with an additional 12 delegates MakeAmericaGreatAgain,Missouri confirmed Trump2016 official winner additional 12 delegates MakeAmericaGreatAgain
4218,0,WOW great new poll New York! Thank you for your support! Trump2016 NewYorkValues,WOW great new poll New York! Thank support! Trump2016 NewYorkValues
4219,0,Thank you Albany New York! MakeAmericaGreatAgain Trump2016,Thank Albany New York! MakeAmericaGreatAgain Trump2016
4220,0,Join me in Rome NY tomorrow! Trump2016 NYPrimary Tickets available,Join Rome NY tomorrow! Trump2016 NYPrimary Tickets available
4221,0,Tune in amp join me live in Albany New York! 7pmE start time! I love you New York! Trump2016 TrumpTrain,Tune amp join live Albany New York! 7pmE start time! love New York! Trump2016 TrumpTrain
4222,0,A very interesting piece by a very good writer KirstenPowers of USATODAY and FoxNews,interesting piece good writer KirstenPowers USATODAY FoxNews
4223,0,Leaving for Albany New York now massive crowd expected Very exciting!,Leaving Albany New York massive crowd expected exciting!
4224,0,Why does the liberal media think Bill OReilly oreillyfactor is a complete and total vulgarian I dont think so!,liberal media think Bill OReilly oreillyfactor complete total vulgarian dont think so!
4225,0,Colorado Trump Delegates Scratched from Ballots at GOP Convention,Colorado Trump Delegates Scratched Ballots GOP Convention
4226,0,This is happening all over our countrygreat people being disenfranchised by politicians Repub party is in trouble!,happening countrygreat people disenfranchised politicians Repub party trouble!
4227,0,AnnesLimo realDonaldTrump WVTTS1017 Thanks for Rochester rally Great people thank you!,AnnesLimo realDonaldTrump WVTTS1017 Thanks Rochester rally Great people thank you!
4228,0,WVTTS1017 realDonaldTrump just listened to you on fox I love you so much Thank you!,WVTTS1017 realDonaldTrump listened fox love much Thank you!
4229,0,autoprofessor17 realDonaldTrump Great job on Fox n Friends this morning Very well spoken and presidential TrumpTrain,autoprofessor17 realDonaldTrump Great job Fox n Friends morning well spoken presidential TrumpTrain
4230,0,TimeHasCome1 WayneDupreeShow ThePatriot143 Trump needs to hold a massive protest rally in Colorado Hed get 100k amp own the news cycle,TimeHasCome1 WayneDupreeShow ThePatriot143 Trump needs hold massive protest rally Colorado Hed get 100k amp news cycle
4231,0,I will be interviewed on foxandfriends at 700 AM Enjoy!,interviewed foxandfriends 700 Enjoy!
4232,0,The people of Colorado had their vote taken away from them by the phony politicians Biggest story in politics This will not be allowed!,people Colorado vote taken away phony politicians Biggest story politics allowed!
4233,0,How is it possible that the people of the great State of Colorado never got to vote in the Republican Primary Great anger totally unfair!,possible people great State Colorado never got vote Republican Primary Great anger totally unfair!
4234,0,MakeAmericaGreatAgain Trump2016,MakeAmericaGreatAgain Trump2016
4235,0,I win a state in votes and then get nonrepresentative delegates because they are offered all sorts of goodies by Cruz campaign Bad system!,win state votes get nonrepresentative delegates offered sorts goodies Cruz campaign Bad system!
4236,0,The nytimes purposely covers me so inaccurately I want other nations to pay the US for our defense of them We are the suckersno more!,nytimes purposely covers inaccurately want nations pay US defense suckersno more!
4237,0,agentvf New Jersey Man Joseph Hornick Willing to Go to Jail for Flying Trump Flag Breitbart Q102Philly,agentvf New Jersey Man Joseph Hornick Willing Go Jail Flying Trump Flag Breitbart Q102Philly
4238,0,getreal1234 realDonaldTrump Kids123Nicholas gqforbes RepTomMarino lets go Pa he has my vote Go Trump,getreal1234 realDonaldTrump Kids123Nicholas gqforbes RepTomMarino lets go Pa vote Go Trump
4239,0,jlopez05391 realDonaldTrump Rochester loves you! See you tomorrow! MakeAmericaGreatAgain Trump2016 TrumpTrain A big crowd!,jlopez05391 realDonaldTrump Rochester loves you! See tomorrow! MakeAmericaGreatAgain Trump2016 TrumpTrain big crowd!
4240,0,becker_berta vivhall3 Reince Millions more will burn their Republican registration if GOP continues to subvert the will of the people,becker_berta vivhall3 Reince Millions burn Republican registration GOP continues subvert people
4241,0,metalmom888 Theresa_Cali If the GOP screws Trump his millions will walk from the GOP never to return! They better think long and hard,metalmom888 Theresa_Cali GOP screws Trump millions walk GOP never return! better think long hard
4242,0,AnnCoulter GOP is trying to steal nomination from the winner Trump not block an insurgent catching up 2 frontrunner Sanders,AnnCoulter GOP trying steal nomination winner Trump block insurgent catching 2 frontrunner Sanders
4243,0,governor_savage realDonaldTrump is the only person who can save us from this corrupt political mess MakeAmericaGreatAgain,governor_savage realDonaldTrump person save us corrupt political mess MakeAmericaGreatAgain
4244,0,Mutual408Grace realDonaldTrump gene70 California women love Mr Trump too Will make it happen in New York on April 19 Go out amp vote,Mutual408Grace realDonaldTrump gene70 California women love Mr Trump make happen New York April 19 Go amp vote
4245,0,Kids123Nicholas gqforbes RepTomMarino realDonaldTrumpLets get it done Philadelphia PaMake Trump your pick for president now,Kids123Nicholas gqforbes RepTomMarino realDonaldTrumpLets get done Philadelphia PaMake Trump pick president
4246,0,PennyHicks13 Carolde kisster1 FoxNews Your tax and economic plans are second to none! Media shld report,PennyHicks13 Carolde kisster1 FoxNews tax economic plans second none! Media shld report
4247,0,Theresa_Cali Poll shows realDonaldTrump leads among registered Republican women with 44 Thank you!,Theresa_Cali Poll shows realDonaldTrump leads among registered Republican women 44 Thank you!
4248,0,vivhall3 realDonaldTrump here your delegate replaced at CO GOP convention Very sad!,vivhall3 realDonaldTrump delegate replaced CO GOP convention sad!
4249,0,A great honor to visit the 911 Memorial Museum with my wife MELANIATRUMP today NewYorkValues,great honor visit 911 Memorial Museum wife MELANIATRUMP today NewYorkValues
4250,0,gene70 realDonaldTrump The Real Person Of The Year! Wow!,gene70 realDonaldTrump Real Person Year! Wow!
4251,0,gene70 realDonaldTrump Fugedaboudit!!! The woman in New York love Donald Trump!!!,gene70 realDonaldTrump Fugedaboudit!!! woman New York love Donald Trump!!!
4252,0,Bernie Sanders says that Hillary Clinton is unqualified to be president Based on her decision making ability I can go along with that!,Bernie Sanders says Hillary Clinton unqualified president Based decision making ability go along that!
4253,0,Isnt it a shame that the person who will have by far the most delegates and many millions more votes than anyone else me still must fight,Isnt shame person far delegates many millions votes anyone else still must fight
4254,0,DnGLax Yes! Thank U 4 coming to LI! It was a thrill 2 B part of it! U will get the job done! MakeAmericaGreatAgain trump2016,DnGLax Yes! Thank U 4 coming LI! thrill 2 B part it! U get job done! MakeAmericaGreatAgain trump2016
4255,0,AlexNightrasor realDonaldTrump lilrachiepoo Trump will be our best president since Reagan!,AlexNightrasor realDonaldTrump lilrachiepoo Trump best president since Reagan!
4256,0,lilrachiepoo realDonaldTrump Thank you Mr Trump for your personal and financial sacrifices in this journey to MAKEAMERICAGREATAGAIN,lilrachiepoo realDonaldTrump Thank Mr Trump personal financial sacrifices journey MAKEAMERICAGREATAGAIN
4257,0,RepaloneLori realDonaldTrump kirstiealley we love you and know you will do an awesome job! Saw you in bethpage !! Thank you,RepaloneLori realDonaldTrump kirstiealley love know awesome job! Saw bethpage !! Thank
4258,0,redneckgp All you haters out there STOP trashing the only candidate realDonaldTrump that will put ALL OF YOU amp AMERICA FIRST trump,redneckgp haters STOP trashing candidate realDonaldTrump put amp AMERICA FIRST trump
4259,0,RepMartinDaniel We support you HaileyPuckett You will go far in life Smart and courageous!,RepMartinDaniel support HaileyPuckett go far life Smart courageous!
4260,0,kirstiealley HELLO BOYS! this is my formal endorsement of realDonaldTrump amp Im a woman! last I checked And Rudy U R amazing!,kirstiealley HELLO BOYS! formal endorsement realDonaldTrump amp Im woman! last checked Rudy U R amazing!
4261,0,Cam Reports are RNC has received 1 million postcards so far! If I get more info on Ill post AnnCoulter,Cam Reports RNC received 1 million postcards far! get info Ill post AnnCoulter
4262,0,Donald TrumpThe Disrupter will air on FoxNews Saturday night and Sunday night at 8 PM ET Anchored by BretBaier johnrobertsFox,Donald TrumpThe Disrupter air FoxNews Saturday night Sunday night 8 PM ET Anchored BretBaier johnrobertsFox
4263,0,Nobody beats me on National Security,Nobody beats National Security
4264,0,Looks like I was right about NATO I had no doubt,Looks like right NATO doubt
4265,0,Jennifer is a terrific person,Jennifer terrific person
4266,0,R_U_OK_UK realDonaldTrump glozee1 PaulManafort CNN DanScavino Vote trump to save the west Dont become like Europe WakeUpAmerica,R_U_OK_UK realDonaldTrump glozee1 PaulManafort CNN DanScavino Vote trump save west Dont become like Europe WakeUpAmerica
4267,0,glozee1 Great interview with PaulManafort on CNN regarding realDonaldTrump path to victory NewDay MakeAmericaGreatAgain DanScavino,glozee1 Great interview PaulManafort CNN regarding realDonaldTrump path victory NewDay MakeAmericaGreatAgain DanScavino
4268,0,WPayton344 PaulManafort Great Interview on CNNBeing from CT I am thrilled you are part of this TeamGO TRUMP!,WPayton344 PaulManafort Great Interview CNNBeing CT thrilled part TeamGO TRUMP!
4269,0,So great to be in New York Catching up on many things remember I am still running a major business while I campaign and loving it!,great New York Catching many things remember still running major business campaign loving it!
4270,0,iamDaveK realDonaldTrump first WWE Hall of Famer to become president,iamDaveK realDonaldTrump first WWE Hall Famer become president
4271,0,DiCristo13 realDonaldTrump lets have the policy speeches on immigration economy foreign policy and NATO!,DiCristo13 realDonaldTrump lets policy speeches immigration economy foreign policy NATO!
4272,0,Keeblerqueen RealRudyGiulian realDonaldTrump Thanks Rudy!!! Trump will be a great president!!,Keeblerqueen RealRudyGiulian realDonaldTrump Thanks Rudy!!! Trump great president!!
4273,0,Genie115 MakeAmericaGreatAgain we can only do that with realDonaldTrump RT,Genie115 MakeAmericaGreatAgain realDonaldTrump RT
4274,0,gracefulme3 seanhannity tedcruz realDonaldTrump Cruz is hated in New York He should go home no place for a phony,gracefulme3 seanhannity tedcruz realDonaldTrump Cruz hated New York go home place phony
4275,0,Ted Cruz attacked New Yorkers and New York values we dont forget!,Ted Cruz attacked New Yorkers New York values dont forget!
4276,0,MakeAmericaGreatAgain Trump2016,MakeAmericaGreatAgain Trump2016
4277,0,Unbelievable evening Just made a speech in front 17000 amazing New Yorkers in Bethpage Long Island great to be home!,Unbelievable evening made speech front 17000 amazing New Yorkers Bethpage Long Island great home!
4278,0,I was not scheduled to be on the oreillyfactor Pure fiction!,scheduled oreillyfactor Pure fiction!
4279,0,It is so great to be back home! Looking forward to a great rally tonight in Bethpage Long Island!,great back home! Looking forward great rally tonight Bethpage Long Island!
4280,0,Still time to get out and VOTE! WIPrimary Trump2016 MAGA,Still time get VOTE! WIPrimary Trump2016 MAGA
4281,0,Wow Politico is in total disarray with almost everybody quitting Good news bad dishonest journalists!,Wow Politico total disarray almost everybody quitting Good news bad dishonest journalists!
4282,0,roadsho Challenge to all WI gun owners Vote realDonaldTrumpThe only candidate that will protect your rights!,roadsho Challenge WI gun owners Vote realDonaldTrumpThe candidate protect rights!
4283,0,Wisconsin we will MAKE AMERICA GREAT AGAIN!,Wisconsin MAKE AMERICA GREAT AGAIN!
4284,0,Good morning Wisconsin! The polls are now open! VoteTrump today amp we will MakeAmericaGreatAgain!,Good morning Wisconsin! polls open! VoteTrump today amp MakeAmericaGreatAgain!
4285,0,MAKE AMERICA GREAT AGAIN!,MAKE AMERICA GREAT AGAIN!
4286,0,FoxNews ScottBaio DonaldTrump is the only guy I think that has the will amp the nerve to attack amp to fight,FoxNews ScottBaio DonaldTrump guy think amp nerve attack amp fight
4287,0,vikkideiter Something VERY close to my heart Im a NAVY VET! I love realDonaldTrumps VETERANS ADMINISTRATION REFORMS,vikkideiter Something close heart Im NAVY VET! love realDonaldTrumps VETERANS ADMINISTRATION REFORMS
4288,0,I will be on SeanHannity FoxNews tonight at 10pmE w MELANIATRUMP from Wisconsin Enjoy! WIPrimary Trump2016,SeanHannity FoxNews tonight 10pmE w MELANIATRUMP Wisconsin Enjoy! WIPrimary Trump2016
4289,0,MAKE AMERICA GREAT AGAIN!,MAKE AMERICA GREAT AGAIN!
4290,0,Leaving Superior Wisconsin now Thank you! Trump2016 WIPrimary,Leaving Superior Wisconsin Thank you! Trump2016 WIPrimary
4291,0,Wow great news from Wisconsin Just made two speeches there with a big one coming tonight Thank you!,Wow great news Wisconsin made two speeches big one coming tonight Thank you!
4292,0,Will be interviewed on SeanHannity on FoxNews from Wisconsin tonight My wife Melania will join me for the entire show,interviewed SeanHannity FoxNews Wisconsin tonight wife Melania join entire show
4293,0,Congratulations Jim Herman! We are all proud of you TrumpGolf!,Congratulations Jim Herman! proud TrumpGolf!
4294,0,Just departing La Crosse Wisconsin Thank you! Trump2016 WIPrimary,departing La Crosse Wisconsin Thank you! Trump2016 WIPrimary
4295,0,This Tweet from realDonaldTrump has been withheld in response to a report from the copyright holder,Tweet realDonaldTrump withheld response report copyright holder
4296,0,A great day in Wisconsin many stops many great people! Melania is joining me on Monday Big crowds MAKE AMERICA GREAT AGAIN!,great day Wisconsin many stops many great people! Melania joining Monday Big crowds MAKE AMERICA GREAT AGAIN!
4297,0,A great night in West Allis Wisconsin! Thank you! VoteTrumpWI WIPrimary,great night West Allis Wisconsin! Thank you! VoteTrumpWI WIPrimary
4298,0,I am on FoxNews with greta doing a town hall from Wisconsin now! Enjoy! MakeAmericaGreatAgain Trump2016,FoxNews greta town hall Wisconsin now! Enjoy! MakeAmericaGreatAgain Trump2016
4299,0,Congratulations to gohermie for winning the ShellHouOpen We are all proud of you TNGCBedminster amp all TrumpGolf clubs! Great going!,Congratulations gohermie winning ShellHouOpen proud TNGCBedminster amp TrumpGolf clubs! Great going!
4300,0,I will be in Milwaukee Wisconsin tomorrow at 7pmE with MELANIATRUMP Join us! WIPrimary Trump2016,Milwaukee Wisconsin tomorrow 7pmE MELANIATRUMP Join us! WIPrimary Trump2016
4301,0,Thank you Miss Katies Diner! MakeAmericaGreatAgain Trump2016,Thank Miss Katies Diner! MakeAmericaGreatAgain Trump2016
4302,0,Thank you New York and Pennsylvania! MakeAmericaGreatAgain Trump2016,Thank New York Pennsylvania! MakeAmericaGreatAgain Trump2016
4303,0,GOPjenna I dont care about the game I care about the PEOPLE And thats exactly why WE THE PEOPLE love you so much! Trump2016,GOPjenna dont care game care PEOPLE thats exactly PEOPLE love much! Trump2016
4304,0,Thank you! Trump2016 WIPrimary,Thank you! Trump2016 WIPrimary
4305,0,007cigarjoe MakeAmericaGreatAgain Trump2016 realDonaldTrump IS THE ONLY DEAL !!!,007cigarjoe MakeAmericaGreatAgain Trump2016 realDonaldTrump DEAL !!!
4306,0,Margee11 WISCONSIN VOTE SMART tedcruz RECORDS R SEALED WHAT IS HE HIDING SAVE AMERICA W realDonaldTrump,Margee11 WISCONSIN VOTE SMART tedcruz RECORDS R SEALED HIDING SAVE AMERICA W realDonaldTrump
4307,0,Wheels155CNN is reviewing the weekbut majority of the show about realDonaldTrump cuz there would be 00 ratings if not Medias a JOKE,Wheels155CNN reviewing weekbut majority show realDonaldTrump cuz would 00 ratings Medias JOKE
